{
  "page": {
    "seo": {
      "title": "INVESTIGACIÓN - Departamento de Inteligencia Artificial",
      "ogTitle": "INVESTIGACIÓN - Departamento de Inteligencia Artificial",
      "ogType": "article",
      "image": "/assets/uploads/2023/11/comision-europea.svg",
      "modifiedTime": "2026-02-06T09:13:09+00:00",
      "robots": "index, follow, max-image-preview:large, max-snippet:-1, max-video-preview:-1"
    }
  },
  "pageTitle": "INVESTIGACIÓN",
  "intro": {
    "title": "Investigación",
    "textHtml": "El DIA destaca, a nivel nacional e internacional, por su productividad y calidad investigadora. Tiene una alta participación en proyectos de investigación financiados con fondos de la Comisión Europea, y coordina varios de ellos. Participa también en numerosos proyectos de financiación pública competitiva nacional y regional, y tiene establecidos contratos de investigación con empresas privadas, bien a través de programas de financiación oficial competitiva (CENIT, CIEN, etc.) o bien a través de contratos directos.<br><br>La&nbsp;financiación externa obtenida&nbsp;por el personal docente e investigador del DIA&nbsp;en el período 2013-2020&nbsp;supera los<mark style=\"background-color:rgba(0, 0, 0, 0)\" class=\"has-inline-color has-ast-global-color-8-color\"> 27.000.000,00 €&nbsp;</mark>y ha sido obtenida a través de"
  },
  "counters": [
    {
      "value": 32,
      "text": "proyectos con financiación procedente de convocatorias internacionales competitivas de la Comisión Europea. La participación en estos proyectos ha permitido la creación de consorcios con más de 400 entidades de 33 países de Europa, América y Asia.",
      "image": "/assets/uploads/2023/11/comision-europea.svg",
      "style": "1zfjuhz"
    },
    {
      "value": 26,
      "text": "proyectos en convocatorias competitivas nacionales y regionales (Ministerio de Ciencia, Innovación y Universidades, Ministerio de Economía, Industria y Competitividad, Instituto de Salud Carlos III, Comunidad de Madrid, etc.).",
      "image": "/assets/uploads/2023/11/logos-gov-y-sp.svg",
      "style": "3kwzisw"
    },
    {
      "value": 146,
      "text": "proyectos en ámbito no competitivo vía contratos con empresas de prestigio públicas y privadas, nacionales e internacionales.",
      "style": "ry276kq"
    }
  ],
  "groupsIntro": {
    "title": "Grupos de investigación",
    "text": "La investigación se realiza en el contexto de diversos grupos de investigación consolidados"
  },
  "image": {
    "src": "/assets/uploads/2023/11/Foto-grupo-de-investigacion-scaled.jpeg",
    "alt": "",
    "caption": "engineers meeting technology research in laoratory, deep blue green colors, panoramatic photo"
  },
  "areasTitle": "Áreas",
  "areas": [
    "Aprendizaje Automático",
    "Bioinformática",
    "Biología de Sistemas",
    "Computación Biomolecular y Biología Sintética",
    "Computación Evolutiva",
    "Grid Semántico",
    "Informática Biomédica",
    "Ingeniería del Conocimiento",
    "Ingeniería Lingüística",
    "Ingeniería Ontológica",
    "Interacción Hombre-Máquina Inteligente",
    "Internet del Futuro",
    "Lenguajes de Alto Nivel y Procesamiento Paralelo",
    "Minería de Datos",
    "Modelos de Elección Bajo Racionalidad Acotada",
    "Modelos de razonamiento",
    "Modelos Lógicos",
    "Nanoinformática",
    "Neurociencia",
    "Programación Lógica (PL) y PL con Restricciones",
    "Recuperación de Información",
    "Redes Bayesianas",
    "Redes Neuronales",
    "Sistemas de Ayuda a la Decisión",
    "Teoría de la Utilidad Multiatributo",
    "Toma de Decisiones en Grupo",
    "Visión por Computador y Robótica",
    "Web Semántica"
  ],
  "groups": [
    {
      "name": "Grupo de Análisis de Decisiones y Estadística",
      "logo": "/assets/uploads/2023/07/logo-dasg-1.jpg",
      "title": "Grupo de Análisis de Decisiones y Estadística",
      "descriptionHtml": "El <strong>Grupo de Análisis de Decisiones y Estadística </strong>se centra principalmente en la resolución de problemas complejos de decisión. Ejemplos de problemas estudiados en el campo de la medicina son los de la ictericia neonatal o la asistencia respiratoria extracorpórea en recién nacidos; en medio ambiente la restauración de ecosistemas acuáticos contaminados tales como el lago Svyatoye al suroeste de Kostyukovichy (Bielorrusia) o el lago Ovre Heimdalsvath cercano a la localidad de Oppland (Noruega); en predicción tales como la gestión de la reserva del agua almacenada en un pantano o la predicción del precio de la electricidad en el mercado español; en simulación la ocurrencia de daños en una línea de clasificación de frutas y en lo social la democracia electrónica.",
      "url": "http://www.dasg.upm.es/",
      "buttonLabel": "Saber más",
      "style": {
        "tabId": "7",
        "wrapper": "hfplefu",
        "wrapperAlign": "outer",
        "wrapperAlignWide": false,
        "heading": "8ne1ae4",
        "button": "f8to60i"
      }
    },
    {
      "name": "Grupo de Economía y Sostenibilidad del Medio Natural",
      "logo": "/assets/uploads/2023/07/ECONOMIA-Y-SOSTENIBILIDAD.png",
      "title": "Grupo de Economía y Sostenibilidad del Medio Natural",
      "descriptionHtml": "El <strong>grupo de Economía y Sostenibilidad del </strong>Medio Natural<a href=\"https://ecsen.es/\" target=\"_blank\" rel=\"noreferrer noopener\"> </a>pretende continuar la labor pluridisciplinar iniciada hace ya años por sus miembros, en la que a través de una síntesis de categorías analíticas de naturaleza ecológica y económica, se desarrollan y aplican métodos operativos para la gestión sostenible del medio natural. La necesidad de proteger el medio natural surge del reconocimiento de su “escasez”, respecto a las demandas que la sociedad ejerce sobre dicho medio natural. Por otra parte, la economía es la ciencia que establece pautas óptimas para la gestión de la “escasez”. De esta manera, la lógica económica se convierte en un instrumento importante para la protección racional del medio natural.",
      "url": "https://ecsen.es/",
      "buttonLabel": "Saber más",
      "style": {
        "tabId": "8",
        "wrapper": "ixvoz7g",
        "wrapperAlign": "outer",
        "wrapperAlignWide": false,
        "heading": "9txpikt",
        "button": "4pvk34j"
      }
    },
    {
      "name": "Grupo de Computación lógica, Lenguajes, Implementación y Paralelismo (CLIP)",
      "logo": "/assets/uploads/2023/11/clip-relief-64g-1.png",
      "title": "Grupo de Computación Lógica, Lenguajes, Implementación y  Paralelismo (CLIP)",
      "descriptionHtml": "El <strong><mark class=\"has-inline-color has-ast-global-color-5-color\">Grupo de Computación lógica, Lenguajes, Implementación</mark><a rel=\"noreferrer noopener\" href=\"/es/grupos-investigacion#CLIP\" data-type=\"link\" data-id=\"https://dia.fi.upm.es/es/grupos-investigacion#CLIP\" target=\"_blank\"><mark class=\"has-inline-color has-ast-global-color-5-color\"> y Paralelismo</mark></a></strong> lleva más de quince años de actividad investigadora en temas relacionados con el avance en los fundamentos, el análisis y la implementación de lenguajes de programación declarativos, la verificación y depuración estática de programas, el aprovechamiento eficiente y sencillo de las arquitecturas paralelas y distribuidas, la extensión de dichos lenguajes a nuevos paradigmas de computación (p.ej., de restricciones, con agentes, móvil, etc.) y la aplicación industrial de la investigación realizada a diversos campos prácticos. El grupo desarrolla el sistema de programación multiparadigma Ciao, software libre bajo licencia LGPL, con numerosos usuarios industriales y académicos a nivel internacional.",
      "url": "https://cliplab.org/",
      "buttonLabel": "Saber más",
      "style": {
        "tabId": "5",
        "wrapper": "dtmw383",
        "wrapperAlign": "inner",
        "wrapperAlignWide": false,
        "heading": "2bi7sph",
        "button": "npagy8z"
      }
    },
    {
      "name": "Grupo de Informática Biomédica",
      "logo": "/assets/uploads/2023/11/logo-grupo-informatica-biomedica.png",
      "title": "Grupo de Informática Biomédica",
      "descriptionHtml": "El<strong> Grupo de Informática Biomédica</strong> ha estado trabajando durante más de 15 años en diversas áreas de la Informática Biomédica como toma de decisiones, procesamiento de imágenes, directrices y protocolos clínicos, ontologías biomédicas, integración de bases de datos, minería de datos, minería de texto, y otros. La experiencia en investigación, y la obtención de fondos para la misma, queda reflejada en el amplio número de publicaciones científicas de alta calidad que se han generado y en la participación en diferentes proyectos a cargo de la Comisión Europea.",
      "url": "http://gib.fi.upm.es/",
      "buttonLabel": "Saber más",
      "style": {
        "tabId": "9",
        "wrapper": "7zyfi8c",
        "wrapperAlign": "outer",
        "wrapperAlignWide": false,
        "heading": "83igprt",
        "button": "henr474"
      }
    },
    {
      "name": "Grupo de Ingeniería Ontológica",
      "logo": "/assets/uploads/2023/11/ONTOLOGY.png",
      "title": "Grupo de Ingeniería Ontológica",